,company,title,zps,link,reqs74,ИП Найдович Злата Павловна,Менеджер аналитик-маркетолог по работе с маркетплейсом Wildberries,30 000 – 300 000 руб.,https://hh.ru/vacancy/79008195?from=vacancy_search_list&query=%D0%BF%D1%80%D0%BE%D0%B4%D1%83%D0%BA%D1%82%D0%BE%D0%B2%D1%8B%D0%B9+%D0%B0%D0%BD%D0%B0%D0%BB%D0%B8%D1%82%D0%B8%D0%BA,"Управление товарным запасом: рассчитывать план и формировать заказы к обеспечению (взаимодействие с отделом производства), не допуская sold out.// Расчет акций и загрузка цен на портал;// Управление ценообразованием (unit экономика, расчет выгодности участия в акциях, скидки и т.д.) контроль остатков;// Сортиментный и конкурентный анализ (мониторинг цен, ежедневный анализ продаж (наших и конкурентов) принятие решения о снижении/повышении цен, А/Б тест контента, SEO анализ по ключам наших и конкурентов.// Запуск рекламных компаний в поиске, карточки товара и контроль пополнения бюджета;// Создание новых карточек (вывод новых продуктов на рынок от создания до продаж от А до Я);// Постоянный а/б тест контента, направленный на повышение CTR, постановка ТЗ для дизайнеров; контроль выполнения задачи согласно ТЗ.// Работа с отзывами и вопросами покупателей (доработка продукта, карточек товара);// Подготовка аналитических отчетов (выводов) вытекающих из анализа данных."
75,КИСЕЛЕВ ГРУПП,Бизнес-аналитик (Специалист по внедрению Битрикс24/amoCRM),80 000 – 140 000 руб.,https://hh.ru/vacancy/79132615?from=vacancy_search_list&query=%D0%BF%D1%80%D0%BE%D0%B4%D1%83%D0%BA%D1%82%D0%BE%D0%B2%D1%8B%D0%B9+%D0%B0%D0%BD%D0%B0%D0%BB%D0%B8%D1%82%D0%B8%D0%BA,"проводим бизнес-анализ клиенту, выявляем слабые места в компании, даем рекомендации;// настраиваем инструменты нашего продукта для следующих целей - для автоматизации различных процессов, для увеличения количества и качества продаж, для прозрачной работы отделов, для удобного контроля руководителем всего, что происходит внутри компании, для сплочения коллектива за счет единого пространства общения и новостей;// обучаем и адаптируем сотрудников и руководителей работать с новыми инструментами регулярно, легко и понятно;// интегрируем (""стыкуем"" / ""дружим"") другие системы с Битрикс24 под индивидуальные запросы клиентов (например 1С, Авито, Государственные реестры)."
76,BINET.PRO,Маркетолог (онлайн-школа),60 000 – 80 000 руб.,https://hh.ru/vacancy/78961809?from=vacancy_search_list&query=%D0%BF%D1%80%D0%BE%D0%B4%D1%83%D0%BA%D1%82%D0%BE%D0%B2%D1%8B%D0%B9+%D0%B0%D0%BD%D0%B0%D0%BB%D0%B8%D1%82%D0%B8%D0%BA,"Удаленную работу: возможность работать в любом удобном месте;// Возможность управлять своим временем максимально эффективно без жесткого контроля со стороны руководства - мы ждем коллег с высоким уровнем самоорганизации и ответственности;// Выплаты заработной платы 2 раза в месяц;// Полная занятость, график работы – 5/2 с 9 до 18 МСК;// Отсутствие бюрократии, только эффективно выстроенные бизнес-процессы;// Возможность работать с сильной командой и руководством в Школе, которая находится на этапе активного масштабирования."
77,Like Центр,Продуктовый маркетолог / Продюсер мероприятий (продукта),110 000 – 145 000 руб.,https://hh.ru/vacancy/79653850?from=vacancy_search_list&query=%D0%BF%D1%80%D0%BE%D0%B4%D1%83%D0%BA%D1%82%D0%BE%D0%B2%D1%8B%D0%B9+%D0%B0%D0%BD%D0%B0%D0%BB%D0%B8%D1%82%D0%B8%D0%BA,
78,Тесуджи,Бизнес-аналитик,от 150 000 руб.,https://hh.ru/vacancy/79235256?from=vacancy_search_list&query=%D0%BF%D1%80%D0%BE%D0%B4%D1%83%D0%BA%D1%82%D0%BE%D0%B2%D1%8B%D0%B9+%D0%B0%D0%BD%D0%B0%D0%BB%D0%B8%D1%82%D0%B8%D0%BA,
79,ООО Диджитал Лайн,Web product analyst,от 120 000 руб.,https://hh.ru/vacancy/73996005?from=vacancy_search_list&query=%D0%BF%D1%80%D0%BE%D0%B4%D1%83%D0%BA%D1%82%D0%BE%D0%B2%D1%8B%D0%B9+%D0%B0%D0%BD%D0%B0%D0%BB%D0%B8%D1%82%D0%B8%D0%BA,"Готовность выполнить тестовое задание;// Технический и аналитический склад ума;// Опыт работы в аналогичной должности от 2 лет;// Полная самостоятельность в работе;// Уверенные знания веб-аналитики и опыт работы с одной или несколькими системами (Google Analytics, Amplitude и др. аналоги);// Опыт в продуктовых практиках cjm, design research, custDev, job stories и пр. (желательно);// Базовое понимание HTML/CSS/JS/Консоль разработчика;// Понимание трендов веб-дизайна и UX/UI;// Английский язык не ниже B1;// Работа с системами аналитики для мобильных приложений;// Базовые навыки SQL, Python(Pandas, Numpy) - как преимущество."
80,ИП Латышев Григорий Олегович,Аналитик по продажам продукции с опытом Маркетплейсов WILDBERRIES (WB) / OZON,40 000 – 75 000 руб.,https://hh.ru/vacancy/78827659?from=vacancy_search_list&query=%D0%BF%D1%80%D0%BE%D0%B4%D1%83%D0%BA%D1%82%D0%BE%D0%B2%D1%8B%D0%B9+%D0%B0%D0%BD%D0%B0%D0%BB%D0%B8%D1%82%D0%B8%D0%BA,
81,Frank RG,Младший аналитик,50 000 – 80 000 руб.,https://hh.ru/vacancy/78372740?from=vacancy_search_list&query=%D0%BF%D1%80%D0%BE%D0%B4%D1%83%D0%BA%D1%82%D0%BE%D0%B2%D1%8B%D0%B9+%D0%B0%D0%BD%D0%B0%D0%BB%D0%B8%D1%82%D0%B8%D0%BA,"Собирать и структурировать данные (качественные и количественные);// Создавать расчетные Excel-модели по заданным вводным, оценивать рынок и рассчитывать ключевые показатели;// Участвовать во встречах с экспертами банковского рынка, помогать в написании обобщающих выводов по итогам интервью;// Участвовать в подготовке отчетов в формате PowerPoint по результатам проведенной исследовательской работы;// Вести коммуникации с клиентами."
82,AgileConsult,Аналитик (бизнес + системный),от 150 000 руб.,https://hh.ru/vacancy/78852762?from=vacancy_search_list&query=%D0%BF%D1%80%D0%BE%D0%B4%D1%83%D0%BA%D1%82%D0%BE%D0%B2%D1%8B%D0%B9+%D0%B0%D0%BD%D0%B0%D0%BB%D0%B8%D1%82%D0%B8%D0%BA,Анализ запросов потенциальных клиентов на возможность и способы их реализации.// Оценка стоимости проектов;// Подготовка техзаданий по проектам;
83,ADVANTA,"Ассистент/аналитик в отдел продаж (B2B, IT)",от 60 000 руб.,https://hh.ru/vacancy/79616466?from=vacancy_search_list&query=%D0%BF%D1%80%D0%BE%D0%B4%D1%83%D0%BA%D1%82%D0%BE%D0%B2%D1%8B%D0%B9+%D0%B0%D0%BD%D0%B0%D0%BB%D0%B8%D1%82%D0%B8%D0%BA,
84,ООО Рукс Солюшенс,Системный аналитик,200 000 – 350 000 руб.,https://hh.ru/vacancy/79118269?from=vacancy_search_list&query=%D0%BF%D1%80%D0%BE%D0%B4%D1%83%D0%BA%D1%82%D0%BE%D0%B2%D1%8B%D0%B9+%D0%B0%D0%BD%D0%B0%D0%BB%D0%B8%D1%82%D0%B8%D0%BA,
85,ООО МАКСБИТСОЛЮШЕН,Product manager,от 300 000 руб.,https://hh.ru/vacancy/78591068?from=vacancy_search_list&query=%D0%BF%D1%80%D0%BE%D0%B4%D1%83%D0%BA%D1%82%D0%BE%D0%B2%D1%8B%D0%B9+%D0%B0%D0%BD%D0%B0%D0%BB%D0%B8%D1%82%D0%B8%D0%BA,
86,Fundraise Up,Business/System Analyst,2 500 – 4 000 USD,https://hh.ru/vacancy/79105274?from=vacancy_search_list&query=%D0%BF%D1%80%D0%BE%D0%B4%D1%83%D0%BA%D1%82%D0%BE%D0%B2%D1%8B%D0%B9+%D0%B0%D0%BD%D0%B0%D0%BB%D0%B8%D1%82%D0%B8%D0%BA,"Мы строим сильную команду людей с горящими глазами. У каждого свой опыт, которым он охотно делится.// У нас нет ветвистой иерархии, все люди доступны на расстоянии zoom-звонка. В компании открыта почти вся финансовая статистика, мы регулярно рассказываем как устроен продукт, продажи, саппорт, откуда появляются клиенты и деньги, что интересного случилось и т.д.// Мы верим в долгие отношения и выдаем сотрудникам сток-опции. Компания хорошо растет — только за прошлый год мы вырастили метрики в 3 раза. Если у нас все получится, эти опции превратятся в сумму, сопоставимую с зарплатой за 10 лет."
87,Альянс ТМК,Маркетолог-аналитик по работе с маркетплейсами,172 413 – 172 413 руб.,https://hh.ru/vacancy/79440997?from=vacancy_search_list&query=%D0%BF%D1%80%D0%BE%D0%B4%D1%83%D0%BA%D1%82%D0%BE%D0%B2%D1%8B%D0%B9+%D0%B0%D0%BD%D0%B0%D0%BB%D0%B8%D1%82%D0%B8%D0%BA,
88,Quantum Art,Системный аналитик,120 000 – 180 000 руб.,https://hh.ru/vacancy/78844575?from=vacancy_search_list&query=%D0%BF%D1%80%D0%BE%D0%B4%D1%83%D0%BA%D1%82%D0%BE%D0%B2%D1%8B%D0%B9+%D0%B0%D0%BD%D0%B0%D0%BB%D0%B8%D1%82%D0%B8%D0%BA,"Аналитическое мышление;// Высокий уровень самоорганизации;// Опыт разработки проектной документации (техническое задание, функциональная спецификация, эксплуатационная документация);// Опыт в проектах по разработке приложений;// Опыт работы с Jira и Confluence;// Уверенные навыки коммуникации;// Понимание принципов работы мобильных и веб приложений."
89,Frank RG,Младший аналитик - исследование рынка,50 000 – 80 000 руб.,https://hh.ru/vacancy/78896323?from=vacancy_search_list&query=%D0%BF%D1%80%D0%BE%D0%B4%D1%83%D0%BA%D1%82%D0%BE%D0%B2%D1%8B%D0%B9+%D0%B0%D0%BD%D0%B0%D0%BB%D0%B8%D1%82%D0%B8%D0%BA,"Собирать и структурировать данные (качественные и количественные);// Создавать расчетные Excel-модели по заданным вводным, оценивать рынок и рассчитывать ключевые показатели;// Участвовать во встречах с экспертами банковского рынка, помогать в написании обобщающих выводов по итогам интервью;// Участвовать в подготовке отчетов в формате PowerPoint по результатам проведенной исследовательской работы;// Вести коммуникации с клиентами."
90,Mindbox,Business analyst / System analyst,150 000 – 220 000 руб.,https://hh.ru/vacancy/54012112?from=vacancy_search_list&query=%D0%BF%D1%80%D0%BE%D0%B4%D1%83%D0%BA%D1%82%D0%BE%D0%B2%D1%8B%D0%B9+%D0%B0%D0%BD%D0%B0%D0%BB%D0%B8%D1%82%D0%B8%D0%BA,
91,КИБЕР-РОМ,Системный аналитик,200 000 – 300 000 руб.,https://hh.ru/vacancy/73723954?from=vacancy_search_list&query=%D0%BF%D1%80%D0%BE%D0%B4%D1%83%D0%BA%D1%82%D0%BE%D0%B2%D1%8B%D0%B9+%D0%B0%D0%BD%D0%B0%D0%BB%D0%B8%D1%82%D0%B8%D0%BA,"Опыт работы с микросервисной архитектурой;// Опыт написания и согласования функциональных требований, нефункциональных требований, технических заданий;// Уверенное знание UML;// Знание принципов построения ИТ систем;// Опыт работы с JIRA и Confluence;// Опыт работы в командах, использующих гибкие методологии разработки;// Системность мышления, оценка влияния на смежные бизнес-процессы/системы;// Критический взгляд + коммуникабельность."
92,ООО Аналитика Бизнеса,Руководитель отдела продаж/ начальник отдела продаж,от 200 000 руб.,https://hh.ru/vacancy/78613218?from=vacancy_search_list&query=%D0%BF%D1%80%D0%BE%D0%B4%D1%83%D0%BA%D1%82%D0%BE%D0%B2%D1%8B%D0%B9+%D0%B0%D0%BD%D0%B0%D0%BB%D0%B8%D1%82%D0%B8%D0%BA,"Руководство менеджерами по продажам (работа строится на холодных звонках);// Выполнение плановых показателей отдела;// Ведение и анализ отчетности работы отдела;// Контроль за соблюдением дисциплины и регламентов компании;// Контроль качества обслуживания клиентов (мониторинг звонков и встреч);// Предоставление обратной связи и проведение брифингов с менеджерами;// Обучение и адаптация новых сотрудников;// Разработка и проведение мотивационных мероприятий;// Обеспечение своевременного решения проблемных/конфликтных ситуаций с клиентами;// Участие в оптимизации бизнес-процессов, написание скриптов и правил работы."
93,Scalaxi,Системный аналитик,от 180 000 руб.,https://hh.ru/vacancy/79548723?from=vacancy_search_list&query=%D0%BF%D1%80%D0%BE%D0%B4%D1%83%D0%BA%D1%82%D0%BE%D0%B2%D1%8B%D0%B9+%D0%B0%D0%BD%D0%B0%D0%BB%D0%B8%D1%82%D0%B8%D0%BA,
94,KR Digital,Ведущий аналитик проектных процессов,250 000 – 350 000 руб.,https://hh.ru/vacancy/79660654?from=vacancy_search_list&query=%D0%BF%D1%80%D0%BE%D0%B4%D1%83%D0%BA%D1%82%D0%BE%D0%B2%D1%8B%D0%B9+%D0%B0%D0%BD%D0%B0%D0%BB%D0%B8%D1%82%D0%B8%D0%BA,
95,Admire,Product manager,до 160 000 руб.,https://hh.ru/vacancy/79416914?from=vacancy_search_list&query=%D0%BF%D1%80%D0%BE%D0%B4%D1%83%D0%BA%D1%82%D0%BE%D0%B2%D1%8B%D0%B9+%D0%B0%D0%BD%D0%B0%D0%BB%D0%B8%D1%82%D0%B8%D0%BA,
96,ООО Феникс,Product Owner,200 000 – 250 000 руб.,https://hh.ru/vacancy/79103948?from=vacancy_search_list&query=%D0%BF%D1%80%D0%BE%D0%B4%D1%83%D0%BA%D1%82%D0%BE%D0%B2%D1%8B%D0%B9+%D0%B0%D0%BD%D0%B0%D0%BB%D0%B8%D1%82%D0%B8%D0%BA,"опыт самостоятельной разработки и согласования продуктовых документов;// опыт описания бизнес/функциональных процессов «с нуля»;// знание основ методологии;// понимание принципов продуктовой аналитики;// опыт работы с кредитными конвейерами не менее 1-го года, как плюс."
97,АО МЦ-Сервис Инжиниринг,Системный аналитик (удаленно),100 000 – 140 000 руб.,https://hh.ru/vacancy/71237602?from=vacancy_search_list&query=%D0%BF%D1%80%D0%BE%D0%B4%D1%83%D0%BA%D1%82%D0%BE%D0%B2%D1%8B%D0%B9+%D0%B0%D0%BD%D0%B0%D0%BB%D0%B8%D1%82%D0%B8%D0%BA,
98,Платформа ОФД,Бизнес/ Системный аналитик,120 000 – 150 000 руб.,https://hh.ru/vacancy/79279451?from=vacancy_search_list&query=%D0%BF%D1%80%D0%BE%D0%B4%D1%83%D0%BA%D1%82%D0%BE%D0%B2%D1%8B%D0%B9+%D0%B0%D0%BD%D0%B0%D0%BB%D0%B8%D1%82%D0%B8%D0%BA,
99,ООО Финбро,Аналитик рекламной монетизации / Media buyer / UA менеджер,70 000 – 300 000 руб.,https://hh.ru/vacancy/79583301?from=vacancy_search_list&query=%D0%BF%D1%80%D0%BE%D0%B4%D1%83%D0%BA%D1%82%D0%BE%D0%B2%D1%8B%D0%B9+%D0%B0%D0%BD%D0%B0%D0%BB%D0%B8%D1%82%D0%B8%D0%BA,
